{
  "id": "exp_demo_gibson",
  "organization_id": "org_demo",
  "project_id": "proj_cloning",
  "name": "Gibson assembly of reporter plasmid",
  "description": null,
  "head_version_id": "expv_demo_gibson_1",
  "version_count": 1,
  "created_at": "2026-05-10T00:00:00Z",
  "updated_at": "2026-05-10T00:00:00Z"
}
